,Event ID,Recalling Firm,Substance Name,Product Description,Ingestion Route,Reason,Classification,Quantity,Voluntary/Mandated,Distribution,Initial Notification Method,Recall Begins,Recall End,Status,City,State,Postal Code,Country
230,67933,Wockhardt Usa Inc.,['na'],"Metoprolol Succinate Extended-Release Tablets, USP, 50 mg, 30-count bottle, Rx only, Manufactured by: Wockhardt Limited, Mumbai, India; Distributed by: Wockhardt USA LLC., 20 Waterview Blvd., Parsippany, NJ  07054, USA; NDC 64679-735-09, UPC 3 64679 73509 1.",na,Failed Dissolution Specifications,Class II,"109,744 bottles",Voluntary: Firm Initiated,Nationwide,Letter,4/1/2014,5/12/2015,Terminated,Parsippany,NJ,7054,United States
231,68779,American Health Packaging,['na'],"Ibuprofen Tablets, USP, 600 mg, 100 tablets per carton (10 x 10), Rx Only, Packaged and Distributed by: American Health Packaging, Columbus, OH 43217, NDC 68084-0703-01",na,Labeling,Class I,"137,300 tablets",Voluntary: Firm initiated,Nationwide and Puerto Rico,"Two or more of the following: Email, Fax, Letter, Press Release, Telephone, Visit",7/1/2014,8/3/2015,Terminated,Columbus,OH,43217-1188,United States
232,69674,Perry Drug Inc.,['na'],"HCG-20,000 U/2 mL Vial, Compounded Rx, Perry Drug Compounding Pharmacy, Overland Park, KS ---NDC 88888-2195-47",na,Lack of Assurance of Sterility;All lots of sterile products compounded by the pharmacy that are within expiry were recalled due to concerns associated with quality control procedures that present a potential risk to sterility assurance that were observed during a recent FDA inspection.,Class II,1 vial,Voluntary: Firm initiated,Kansas and Missouri,Letter,11/7/2014,11/3/2015,Terminated,Overland Park,KS,66215-2305,United States
233,73662,Reliable Rexall-A Compounding Pharmacy,['na'],"All spironolactone Products, Rx Only, Compounded by RELIABLE DRUG/RELIABLE COMPOUNDING PHARMACY, 801 Irving St., SAN FRANCISCO, CA 94122.",na,Lack of Processing Controls,Class II,,Voluntary: Firm initiated,"U.S. Including: CA, HI, NM",Press Release,3/25/2016,4/10/2017,Terminated,San Francisco,CA,94122-2310,United States
234,71371,The Compounding Pharmacy of America,['na'],"Hyaluronic Acid Sodium 28 mg/ml + Lidocaine HCl 3 mg/ml Injection, ml Syringe, Sterile, Room Temperature, The Compounding Pharmacy of America, Knoxville, TN",na,Lack of Assurance of Sterility; FDA inspection identified GMP violations potentially impacting product quality and sterility,Class II,20 ml total,Voluntary: Firm initiated,Nationwide,Telephone,6/2/2015,2/10/2016,Terminated,Knoxville,TN,37919-4068,United States
235,79748,"Kroger Specialty Pharmacy, Inc.",['na'],Orkambi 100 mg/125 mg Tablets #112 NDC 51167-0700-02 28 days supply.,na,Lack of Processing Controls,Class II,Unknown,Voluntary: Firm initiated,"MS, LA, AR, IL, FL",Letter,4/3/2018,5/7/2020,Terminated,Vicksburg,MS,39180-7153,United States
236,80454,Mylan Pharmaceuticals Inc.,['na'],"Triamterene and Hydrochlorothiazide Tablets, USP 37.5 mg/25 mg, 100-count bottle, Rx only, Mylan Pharmaceuticals, Inc. Morgantown, WV 26505, NDC 0378-1352-01",na,Sub-Potent Drug,Class III,"28,436 bottles",Voluntary: Firm initiated,Nationwide within the United States,Letter,7/9/2018,1/16/2020,Terminated,Morgantown,WV,26505-2730,United States
237,89909,TMC Acquisition LLC dba Tailor Made Compounding,['na'],"GAC (Glutamine/Arginine/L-Carnitine) 25mg/100mg/250mg/mL, 30mL-vial, Refrigerate, Tailor Made Compounding",na,Lack of Assurance of Sterility,Class II,90 vials,Voluntary: Firm initiated,Nationwide USA and Puerto Rico,Letter,3/7/2022,,Ongoing,Nicholasville,KY,40356-8512,United States
238,80750,Product Quest Manufacturing LLC,['na'],"Thayers Natural Remedies, Saline Nasal Spray, Allergy & Sinus Relief, Slippery Elm, 1.5 FL OZ (44 mL) bottle, Distributed By: Product Quest Manufacturing, LLC, 330 Carswell Ave., Daytona Beach, FL 32117, UPC 7 27510 00660 4.",na,CGMP Deviations,Class II,"22,392 bottles",Voluntary: Firm initiated,Nationwide in the USA,Letter,8/3/2018,3/30/2021,Terminated,Daytona Beach,FL,32117-4416,United States
239,87511,"Sanit Technologies, LLC dba Durisan",['na'],"Durisan Antimicrobial Solutions (benzalkonium chloride) Hand Sanitizing Wipes, 0.13%, 160-count canister; Sanit Technologies, LLC, 7810 25th Court East, Sarasota, Florida 34243, UPC 8 52379 00631 8.",na,Microbial Contamination of Non-Sterile Products,Class I,"42,905 canisters TOTAL",Voluntary: Firm initiated,Nationwide in the USA and Bahamas,Letter,3/10/2021,1/19/2022,Terminated,Sarasota,FL,34243-2841,United States
240,86268,"Maison Terre, LLC",['na'],"Goldenseal Root Powder Organic, 1 oz. clear plastic bag, Maison Terre Natural Products, www.maisonterre.net",na,Microbial Contamination of Non-Sterile Products,Class I,670 bags,Voluntary: Firm initiated,Nationwide.,Press Release,8/17/2020,1/27/2021,Terminated,North Little Rock,AR,72114-4630,United States
241,80601,King Bio Inc.,['na'],"Dr. King's SafeCare Rx Heavy Metal Detox, 2 fl. oz. (59 mL), King Bio, Inc., 3 Westside Drive, Asheville, NC 28806 USA, UPC 357955028123, NDC 57955-0281-2",na,Microbial Contamination,Class I,896 bottles,Voluntary: Firm initiated,"U.S.A. Nationwide, Canada, and Australia.",Press Release,7/20/2018,1/19/2022,Terminated,Asheville,NC,28806-2846,United States
242,81344,"Bound Tree Medical, LLC",['na'],"Curaplex Epi Kit NOT FOR IV USE, #8600-01120, Epi-Safe Kit 8600-01 120 contains:2 Safety-LOK Syringe, TB, 1cc w/ needle, 25 ga x5/8 , 2 Vials of epinephrine, 1mg/1mL, 4 Alcohol prep pads, 2 Adhesive bandages, 1  x 3   1 Epi Generic Injection. Rx Only. Distributed by Sarnova HC, LLC s family of companies: Bound Tree Medical, LLC, Cardio Partners, Inc., Emergency Medical Products, Inc. & Tri-anim Health Services, Inc. 5000 Tuttle Crossing Blvd. Dublin, OH 43016",na,Labeling Incorrect Instructions,Class II,339 kits (1 standard syringe / 1 IFU per kit),Voluntary: Firm initiated,Nationwide in the USA,Letter,11/2/2018,6/5/2020,Terminated,Dallas,TX,75208,United States
243,83136,"Infusion Options, Inc.",['na'],"DOCETAXEL 60 MG / 250 ml D5W IVPB; DOCETAXEL 71 MG/ 250 ML NS IVPB; DOCETAXEL 155 MG/ 250 ml NS IVPB; DOCETAXEL 110 mg / 250 ml NS IVPB; DOCETAXEL 150 MG / 250 ml NS IVPB; DOCETAXEL 137 mg / 250 ml 0.9% NACL IVPB; DOCETAXEL 130 MG/ 250 ml NS IVPB; DOCETAXEL 140 MG/ 250 ml NS IVPB; DOCETAXEL 144 MG/ 250 ML NS IVPB; DOCETAXEL 117 MG/ 250 ML NS IVPB; DOCETAXEL 30 mg / 250 ml D5W IVPB; DOCETAXEL 125 MG/ 250 ml NS IVPB; DOCETAXEL 135 MG / 250 ml NS IVPB, Rx Only, Infusion Options, Inc. 5924 13the Ave, Brooklyn, NY 11219-4934, 718-283-7233",na,Lack of Assurance of Sterility,Class II,,Voluntary: Firm initiated,NY only,Letter,6/12/2019,,Ongoing,Brooklyn,NY,11219-4934,United States
244,91442,"Ascend Laboratories, LLC",['METOPROLOL SUCCINATE'],"Metoprolol Succinate Extended-Release Tablets, USP 25 mg, Rx Only, 100 Tablets per bottle,  Manufactured by: Alkem Laboratories Ltd., Mumbai - 400 013, India, Distributed by: Ascend Laboratories, LLC, Parsippany NJ 07054, NDC 67877-590-01.",ORAL,Failed Dissolution Specifications,Class II,"49,632 bottles",Voluntary: Firm initiated,Nationwide and Puerto Rico,E-Mail,1/5/2023,,Ongoing,Parsippany,NJ,07054-3707,United States
245,66568,Compounding Centre At Blue Ridge,['na'],"PGE 20 mcg/mL Injectable, 10 mL, and PGE 40 mcg/mL, 5 mL, Rx Only, The Compounding Center at Blue Ridge, 2601 Blue Ridge Rd, Raleigh, NC 27607.",na,Lack of Assurance of Sterility; All lots of sterile products compounded by the pharmacy within expiry are subject to this recall. This recall is initiated due to concerns associated with quality control procedures observed during a recent FDA inspection.,Class II,11 units,Voluntary: Firm initiated,NC,Telephone,10/18/2013,4/19/2017,Terminated,Raleigh,NC,27607-6481,United States
246,84105,"Green Lumber Holdings, LLC",['na'],"Green Lumber Natural Fuel For Men capsule, packaged in packs of 2, 4 and 10 capsules, 2618 San Miguel Drive, Suite #296, Newport Beach, CA 92660 (949) 426-8622.",na,Marketed Without An Approved NDA/ANDA,Class I,"approx. 30,000 capsules",Voluntary: Firm initiated,"United States and Canada. Only email addresses were provided, no physical address information was received.",Letter,10/22/2019,3/22/2023,Terminated,Corona Del Mar,CA,92625-2200,United States
247,91577,BIOCON PHARMA INC,['POSACONAZOLE'],"Posaconazole Delayed-Release Tablets, 100 mg, 60-count bottle, Rx Only, Manufactured for: Biocon Pharma Inc., Iselin, NJ  08830-3009; Manufactured by: Biocon Pharma Limited, Bengaluru, India - 560 099, NDC 70377-038-11.",ORAL,Failed Impurities/Degradation Specifications,Class II,3665 bottles,Voluntary: Firm initiated,Nationwide in the USA,E-Mail,1/31/2023,,Ongoing,ISELIN,NJ,8830,United States
248,65690,"Aidapak Services, LLC",['na'],"SILDENAFIL CITRATE, Tablet, 25 mg, Rx only, Distributed by: AidaPak Service, LLC, NDC 00069420030.",na,Labeling,Class II,30 Tablets,Voluntary: Firm initiated,"Repacked drugs were distributed in Arizona, California, Oregon, and Washington.",Telephone,7/2/2013,2/7/2014,Terminated,Vancouver,WA,98684-3501,United States
249,79748,"Kroger Specialty Pharmacy, Inc.",['na'],Copaxone 20 mg Injection PFS (30) NDC 68546-0317-30 30 days supply.,na,Lack of Processing Controls,Class II,Unknown,Voluntary: Firm initiated,"MS, LA, AR, IL, FL",Letter,4/3/2018,5/7/2020,Terminated,Vicksburg,MS,39180-7153,United States
250,74326,Sandoz Inc,['na'],"Lisinopril Tablets USP, 30 mg, 100-count bottle, Rx Only,  Manufactured by Sandoz  Inc., Princeton, NJ 08540, NDC 0185-0630-01",na,Labeling,Class III,"3,048 bottles ( 304,800 tablets)",Voluntary: Firm initiated,Nationwide,Letter,5/25/2016,4/25/2017,Terminated,Princeton,NJ,08540-6604,United States
251,86990,SCA Pharmaceuticals,['na'],"HYDROmorphone HCl 10mg/50mL in 0.9% Sodium Chloride Injection, CII, Rx Only, 50 mL Single Dose Syringe, SCA Pharmaceuticals, 755 Rainbow Rd., Windsor, CT, 06095, barcode 70004030022",na,"Lack of Assurance of Sterility; potential for a defective syringe cap, resulting in a non-integral unit",Class II,428 syringes,Voluntary: Firm initiated,Product was distributed to hospitals nationwide.,Letter,12/17/2020,11/2/2021,Terminated,Windsor,CT,06095-1024,United States
252,88872,"MACLEODS PHARMA USA, INC",['RIZATRIPTAN BENZOATE'],"Rizatriptan Benzoate Film Coated Tablets, 10 mg, packaged in a) 12 Tablets (2X6 Unit-Dose Tablets) Blister Packs, NDC 33342-088-45), b) 18 Tablets (3 x 6 Unit-Dose Tablets, NDC 33342-088-41) Rx only, Manufactured for: Macleods Pharma USA, Inc. Plainsboro, NJ 08536l Manufactured by: Macleods Pharmaceuticals Ltd. Baddi, Himachal Pradesh, INDIA",ORAL,Out-of-specification test results obtained in Organic Impurities test during analysis of controlled samples.,Class III,"135,082 Blister Packs/2,431,476 tablets",Voluntary: Firm initiated,Nationwide within the United States,Letter,10/18/2021,,Ongoing,Princeton,NJ,08540-6611,United States
253,88442,Teva Pharmaceuticals USA,['na'],"Epoprostenol Sodium for Injection, 1.5 mg/vial, 10 mL vials, Rx only, Teva Pharmaceuticals USA, Inc. North Wales, PA 19454, NDC 0703-1995-01",na,Lack of Assurance of Sterility,Class II,"12,698 vials",Voluntary: Firm initiated,"Product was distributed Nationwide, including Puerto Rico.",Letter,7/29/2021,,Ongoing,Parsippany,NJ,07054-1120,United States
254,91952,"Preferred Pharmaceuticals, Inc.",['na'],"Doxazosin Tablets, USP, 4 mg, 100-count bottle, Rx only, Manufactured: Accord Healthcare, Inc., Durham, NC 27703, NDC 68788-7149-1",na,CGMP Deviations for the manufacturing Firm (Accord Healthcare) after their inspection.,Class II,4 Bottles,Voluntary: Firm initiated,USA Nationwide,Letter,3/23/2023,,Ongoing,Anaheim,CA,92807-1801,United States
255,75415,North American Rescue LLC.,['na'],"Advance Trauma Kit - Product Code 85-0742, 85-0746, 85-0745, 85-0639, 85-0744, 85-0744, 85-0741, North American Rescue",na,Lack of Assurance of Sterility,Class II,unknown,Voluntary: Firm initiated,"Nationwide, Australia & Switzerland",Letter,9/27/2016,3/9/2017,Terminated,Greer,SC,29650-4791,United States
256,77109,Teva Pharmaceuticals USA,['na'],"Clozapine Tablets USP, 25 mg, 100-count bottle (NDC 0093-4359-01), 500- count bottle (NDC 0093-4359-05), 100 Unit Dose Blisters per carton (NDC 0093-4359-93), Individual Blister Pack (NDC 0093-4359-19), Rx Only, Manufactured By: Teva Pharmaceutical Industries Ltd., Jerusalem, 9777600, Israel",na,Microbial Contamination of Non-Sterile Products,Class II,,Voluntary: Firm initiated,Nationwide,Letter,4/24/2017,2/2/2018,Terminated,North Wales,PA,19454-1505,United States
257,68285,Zydus Pharmaceuticals USA Inc,['PROMETHAZINE HYDROCHLORIDE'],"PROMETHAZINE HYDROCHLORIDE Tablets, USP, 25 mg, 100 Tablet Bottles, Rx Only.  Manufactured by: Cadila Healthcared Ltd., India.  Distributed by: Zydus Pharmaceuticals USA Inc., Pennington, NJ 08534. NDC: 68382-041-01",ORAL,Presence of Foreign Tablets,Class II,"10,200 bottles",Voluntary: Firm Initiated,Nationwide,Letter,5/8/2014,2/26/2016,Terminated,Pennington,NJ,08534-3601,United States
258,76472,Synergy Rx,['na'],"REVERSE DML LOTION (Ketoconazole 2%, Metronidazole 2%, sulfacetamide sodium 10%), Rx only, Synergy RX, 4901 Morena Blvd # 504-A San Diego, CA 92117 (855) 792-6676",na,Lack of Assurance of Sterility,Class II,,Voluntary: Firm initiated,Nationwide within the United States,Telephone,2/10/2017,5/23/2017,Terminated,San Diego,CA,92117-7310,United States
259,65360,"Lowlite Investments, Inc. D/B/A Olympia Pharmacy",['na'],"Metabolase Injection, compounded by Olympia Pharmacy, Orlando, FL",na,Lack of Assurance of Sterility,Class II,2,Voluntary: Firm initiated,Nationwide and PR,"Two or more of the following: Email, Fax, Letter, Press Release, Telephone, Visit",5/29/2013,,Ongoing,Orlando,FL,32835-3500,United States
260,70452,Attix Pharmaceuticals,['na'],"Bovine Insulin active pharmaceutical ingredient packaged in varying grams or kg in bags or drums, Attix Pharmaceuticals, 184 Front Street East, Unit 801, Toronto, Ontario M5A 4N3, Canada",na,Penicillin Cross Contamination,Class II,10 grams,Voluntary: Firm initiated,Nationwide to compounding pharmacies and research organizations.,"Two or more of the following: Email, Fax, Letter, Press Release, Telephone, Visit",11/14/2014,10/7/2015,Terminated,Toronto,,,Canada
261,90566,"Family Dollar Stores, Llc.",['na'],AMBI NRSHNG DAILY FACIAL MSTURZER 1.7 OZ distributed to specific Family Dollar Stores 04/30/2022 through 06/10/2022.,na,CGMP Deviations,Class II,Unknown,Voluntary: Firm initiated,Nationwide within the United States,Other,6/23/2022,,Ongoing,Chesapeake,VA,23320-1604,United States
262,65479,"Main Street Family Pharmacy, LLC",['na'],"Alphahydroxyprogesterone, 250mg, Main Street Compounding Pharmacy, 126 East Main Street, Newbern, TN 38059, 888-658-6200",na,The firm received seven reports of adverse reactions in the form of skin abscesses potentially linked to compounded preservative-free methylprednisolone 80mg/ml 10 ml vials.,Class II,17 units,Voluntary: Firm initiated,"nationwide, specifically:  AK, AL, AZ, CA, CO, CT, DC, FL, GA, HI, IL, IN, KS, KY, LA, MA, MD, MN, MO, MS, NC,   NE, NH, NJ, NM, NV, NY, OH, OK, OR, PA, SC, TN, TX, UT, VA, WA, WI, and WV",Telephone,5/28/2013,4/22/2014,Terminated,Newbern,TN,38059,United States
263,88862,"Vita Pharmacy, LLC dba Talon Compounding Pharmacy",['na'],"TRI-TEST 200 (CY50%-EN37.5%-PR12.5%) INJ #1 200MG/ML INJECTABLE, Rx only, Talon Compounding Pharmacy, 2950 Thousand Oaks Drive Ste 25, San Antonio, Texas 78247",na,Lack of Assurance of Sterility,Class II,4 vials,Voluntary: Firm initiated,"United States including Washington, D.C. and Puerto Rico",Telephone,10/12/2021,10/4/2023,Terminated,San Antonio,TX,78247-3347,United States
264,71371,The Compounding Pharmacy of America,['na'],"Hydromorphone 50 mg/ml + Fentanyl 3,000 mcg/ml + Bupivacaine 20 mg/ml Intrathecal Solution, Sterile-Preservative Free, The Compounding Pharmacy of America, Knoxville, TN",na,Lack of Assurance of Sterility; FDA inspection identified GMP violations potentially impacting product quality and sterility,Class II,23 ml,Voluntary: Firm initiated,Nationwide,Telephone,6/2/2015,2/10/2016,Terminated,Knoxville,TN,37919-4068,United States
265,92253,"Central Admixture Pharmacy Services, Inc.",['na'],"Cardioplegia Solution, Maintenance 4:1 Plasma-Lyte/Tromethamine, low potassium, packaged in 1000 mL per bag, Rx only, Central Admixture Pharmacy Services, Inc., Lehigh Valley, 6580 Snowdrift Road, Allentown, PA  18106, NDC 71285-0112-1.",na,Lack of Assurance of Sterility,Class II,476 bags,Voluntary: Firm initiated,Nationwide in the USA.,E-Mail,4/28/2023,,Ongoing,Allentown,PA,18106-9331,United States
266,89152,Dental Alliance Holdings LLC,['na'],"CTx7 Kit, contains one tube CariFree CTx4 Gel 5000, 1.1% Neutral Sodium Fluoride Mint, 2 oz (57 g) Rx only NDC: 61578-205-01 Manufactured by Oral BioTech Albany, Oregon 97321 and one bottle of CariFree CTx3 Rinse, Mint Anticavity Rinse, 16 fl oz. bottle.",na,Sub-Potent Drug,Class III,3 single tubes of lot 192107 and 3 single tubes of 192108,Voluntary: Firm initiated,Distributed nationwide with the United States,Letter,12/3/2021,8/11/2022,Terminated,Albany,OR,97321-3074,United States
267,73960,"Pharmakon Pharmaceuticals, Inc.",['na'],"Oxytocin 10 Units added to Lactated Ringers in a 500 mL lntravia bag, Rx Only, Compounded by PHARMAKON Pharmaceuticals, Noblesville, IN 46060, NDC 45183-0764-03",na,Lack of Assurance of Sterility,Class II,72,Voluntary: Firm initiated,"Nationwide        VA/DOD: CA, KY, MD, NC, OK, TX, VA",Press Release,4/20/2016,1/11/2018,Terminated,Noblesville,IN,46060-3303,United States
268,79472,"Dr. Reddy's Laboratories, Inc.",['CLOCORTOLONE PIVALATE'],"Clocortolone Pivalate Cream, 0.1%, 90-gram tube, Rx only, Distributed by: Dr. Reddy's Laboratories, Inc. Princeton, NJ 08540, Manufactured by: DPT,  Laboratories Ltd. San Antonio, TX 78215, NDC 43598-341-90",TOPICAL,Failed Stability Specifications,Class III,"4,152 tubes",Voluntary: Firm initiated,Product was distributed Nationwide in the USA.,Letter,3/8/2018,4/29/2019,Terminated,Princeton,NJ,08540-6623,United States
269,80343,Gaia Ethnobotanical LLC,['na'],"Gaia Kratom (mitragyna speciosa) powder, Red Kapuas Hulu , 1oz, 250g, 1kg packages, Gaia Ethnobotanical.com",na,Microbial Contamination of Non-Sterile Product; FDA analysis found  salmonella Contamination,Class I,unknown,Voluntary: Firm initiated,Nationwide.,Press Release,6/20/2018,1/26/2022,Terminated,Henderson,NV,89052-3107,United States
270,83074,RXQ Compounding LLC,['na'],"GLUTATHIONE 200MG/ML (MDV) INJECTION SOLN, 30 ML per vial, RXQ Compounding, 340 West State Street, Unit 9, Athens, OH 45701. NDC: 70731-0906-30",na,Lack of Assurance of Sterility,Class II,,Voluntary: Firm initiated,Nationwide USA,Press Release,6/19/2019,9/16/2022,Terminated,Athens,OH,45701-1564,United States
271,71535,the Compounder,['na'],"BIEST TD 80/20  (Estradiol (E2) Trit (Yellow)/Estriol USP Micronized (E3) : PROG (Progesterone USP Micronized) : DHEA (Dehydroepiandrosterone Micronized) IN VERSABASE W/V (weight/volume) 2.5 : 25 :1.25MG/ML Transdermal cream, dispensed in 10 mL prefilled, amber syringes, Rx only, The Compounder, 340 Marshall Avenue Unit 100, Aurora, IL 60506.",na,Recalled products were made using an active ingredient that was recalled by a supplier due to penicillin Cross Contamination.,Class II,66 (10mL) syringes,Voluntary: Firm initiated,Nationwide,Telephone,3/10/2015,5/19/2016,Terminated,Aurora,IL,60506-5649,United States
272,80601,King Bio Inc.,['na'],"NET Remedies #12 (Pink Label) Homeopathic Preparation, Oral Liquid, 57 mL, Manufacturer: King Bio Inc. U.S.A., Supplier: NET (Australia) Pty LTD 428 Hume Street, Toowoomba QLD 4350, Australia",na,Microbial Contamination,Class I,997 bottles,Voluntary: Firm initiated,"U.S.A. Nationwide, Canada, and Australia.",Press Release,7/20/2018,1/19/2022,Terminated,Asheville,NC,28806-2846,United States
273,89646,Mckesson Medical-Surgical Inc. Corporate Office,['CEFAZOLIN SODIUM'],"Cefazolin for injection USP, and Dextrose Injection, USP, 2 g, 50 mL duplex container, Rx only, MFG: B. Braun Medical Inc., NDC 0264-3105-11",INTRAVENOUS,CGMP Deviations,Class II,39 cases,Voluntary: Firm initiated,USA nationwide.,Letter,4/13/2022,11/30/2023,Terminated,Richmond,VA,23233,United States
274,83397,Wise Pharmacy,['na'],"Papaverine/Phentolamine/Alprostadil 30 mg/2 mg/30 mcg/mL Injectable, 2.5 mL Vial, Rx only, Compounded by Wise Pharmacy, Littleton, CO 80123.",na,Lack of Processing Controls,Class II,97 vials,Voluntary: Firm initiated,"CO, TX, WY",Letter,7/22/2019,2/3/2020,Terminated,Littleton,CO,80123-3095,United States
275,79619,Partell Specialty Pharmacy,['na'],"TM #4 (ALP 20/PAPAV/PHENT 2), 3 mL amber vial, Rx only, Partell Specialty Pharmacy, 5835 S. Eastern Ave. #101, Las Vegas, NV 89119 (702) 791-3800",na,Lack of Assurance of Sterility,Class II,,Voluntary: Firm initiated,NV only,Letter,3/22/2018,1/15/2019,Terminated,Las Vegas,NV,89119-3031,United States
276,87828,Scentsational Soaps & Candles Inc,['na'],"Goose Creek Hand Sanitizer aloe Watermelon Lemonade, Anti-Bacterial Spray, 3.38 FL. OZ. (100 mL), Goose Creek www.GooseCreekCandle.com, 1498 S. Wallace Wilkinson Blvd., Liberty, KY 42539, UPC 814630 02423 3",na,Chemical Contamination,Class I,"1,296 bottles",Voluntary: Firm initiated,USA Nationwide,Press Release,4/27/2021,12/2/2022,Terminated,Venice,FL,34292-1726,United States
277,89450,CARDINAL HEALTHCARE,['RIVASTIGMINE'],"RIVASTIGMINE TRANSDERMAL SYSTEM, Delivers 4.6 mg/24 hours, 30 systems per box, Rx Only, Distributed by: Alvogen, Inc., Morristown, NJ 07960.  NDC 47781-304-03",TRANSDERMAL,CGMP Deviations,Class II,1 unit,Voluntary: Firm initiated,Nationwide USA,Letter,1/26/2022,,Completed,Dublin,OH,43017-1094,United States
278,79967,Ideaz Llc,['na'],"screamin' hot (capsaicin) Pain Relieving Gel, 0.03%, packaged in a) 2 OZ (57g) tubes, UPC 7 50263 80072 4; b) 5 oz. (141g) tubes, UPC 7 50263 80007 6; and c) 16 oz. (454g) bottles, UPC 7 50263 80076 2; MFD FOR: Toast Products, 400 Sproul Street, Pittsburgh, PA 15136; NDC 52099-8005.",na,CGMP Deviations,Class II,820.125 pounds,Voluntary: Firm initiated,Nationwide in the U.S.A.,Letter,5/16/2018,11/6/2018,Terminated,Mc Kees Rocks,PA,15136-2811,United States
279,66015,Novartis Pharmaceuticals Corp.,['na'],"Exforge HCT (amlodipine, valsartan, hydrochlorothiazide) 5/160/25 mg, Rx only, 7 tablets per bottle, Physician Sample - Not For Sale. Manufactured by: Novartis Pharma Stein AG Stein, Switzerland.  Distributed by: Novartis Pharmaceuticals Corp. East Hanover, New Jersey 07936, NDC # 0078-9560-89",na,Chemical Contamination,Class II,"174,848 bottles",Voluntary: Firm initiated,Nationwide and Puerto Rico,Letter,8/8/2013,12/21/2015,Terminated,Suffern,NY,10901-4106,United States
280,81810,"Promise Pharmacy, LLC",['na'],"Glycyrrhizic Acid, 8mg/mL Injection, 10ml vial, Rx Only, Promise Pharmacy Compounding Specialists 31818 US Hwy 19N, Palm Harbor, FL 34684",na,Lack of Assurance of Sterility.,Class II,2 10ml vials,Voluntary: Firm initiated,Nationwide in the USA.,Letter,12/17/2018,3/30/2021,Terminated,Palm Harbor,FL,34684-3713,United States
281,91958,Teva Pharmaceuticals USA Inc,['na'],"Montelukast Sodium Oral Granules USP, 4 mg, packaged in a carton containing 30 packets, Rx only, Distributed By: Teva Pharmaceuticals USA, Inc., Parsippany, NJ 07054, Carton NDC 0093-7487-56, Packet NDC 0093-7487-19",na,Failed Impurities/Degradation Specifications,Class III,"3,772 cartons",Voluntary: Firm initiated,USA Nationwide,Letter,3/27/2023,8/23/2023,Terminated,Parsippany,NJ,07054-1120,United States
282,71535,the Compounder,['na'],"BIEST TD 91/9 (Estriol USP Micronized (E3)/Estradiol (E2) Trit (Yellow)) : PROGESTERONE W/V (weight/volume) PLO (Pluronic F127 20% or Polox 20% gel) 3.3 MG/ML : 40  MG/ML Transdermal cream, dispensed in 10 mL prefilled, amber syringes, Rx only, The Compounder, 340 Marshall Avenue Unit 100, Aurora, IL 60506.",na,Recalled products were made using an active ingredient that was recalled by a supplier due to penicillin Cross Contamination.,Class II,10 (10mL) syringes,Voluntary: Firm initiated,Nationwide,Telephone,3/10/2015,5/19/2016,Terminated,Aurora,IL,60506-5649,United States
283,69152,"Martin Avenue Pharmacy, Inc.",['na'],"Phentolamine mesylate 5 mg/35 mg/mannitol trituration packaged in a white jar, Martin Avenue Pharmacy, 1247 Rickert Dr, Naperville, IL.",na,Lack of Assurance of Sterility,Class II,135.9261 gm,Voluntary: Firm initiated,Nationwide,"Two or more of the following: Email, Fax, Letter, Press Release, Telephone, Visit",8/27/2014,5/31/2018,Terminated,Naperville,IL,60540-1008,United States
284,72233,Bedford Pharmacy,['na'],"P-P-P (COBAL) 30-1-5/mL, Injection,Bedford Pharmacy, 209 Route 101, Bedford, NH 03110, (603) 472-3919",na,Lack of Assurance of Sterility,Class II,1 vial,Voluntary: Firm initiated,"NH, MA",Letter,9/22/2015,6/8/2016,Terminated,Bedford,NH,03110-5440,United States
285,70452,Attix Pharmaceuticals,['na'],"Methotrexate Sodium active pharmaceutical ingredient packaged in varying grams or kg in bags or drums, Attix Pharmaceuticals, 184 Front Street East, Unit 801, Toronto, Ontario M5A 4N3, Canada",na,Penicillin Cross Contamination,Class II,25 grams,Voluntary: Firm initiated,Nationwide to compounding pharmacies and research organizations.,"Two or more of the following: Email, Fax, Letter, Press Release, Telephone, Visit",11/14/2014,10/7/2015,Terminated,Toronto,,,Canada
