,Event ID,Recalling Firm,Substance Name,Product Description,Ingestion Route,Reason,Classification,Quantity,Voluntary/Mandated,Distribution,Initial Notification Method,Recall Begins,Recall End,Status,City,State,Postal Code,Country
338,70713,"Matheson, Inc.",['AIR'],"AIR COMPRESSED, Medical Air, USP, Rx Only.  Matheson Tri-Gas, Inc., 150 Allen Road, Basking Ridge, NJ 07920.  Available in A) E or 22 cu ft cylinder, NDC: 55037-302-09; B) 40 cu ft cylinder, NDC: 55037-302-10; C) 200 cu ft cylinder, NDC: 55037-302-15; D) 220 cu ft cylinder, NDC: 55037-302-16; E) 300 cu ft cylinder, NDC: 55037-302-18, 55037-302-19, 55037-302-20.",RESPIRATORY (INHALATION),Failed Impurities/Degradation Specification; out of specification results for carbon dioxide,Class III,"137,880 cubic feet",Voluntary: Firm initiated,Michigan and Wisconsin,"Two or more of the following: Email, Fax, Letter, Press Release, Telephone, Visit",3/10/2015,4/17/2015,Terminated,New Brighton,MN,55112-3279,United States
339,80655,"Right Value Drug Stores, Inc.",['na'],"Testosterone 200 mg Pellet, Rx only, Carie Boyd's Prescription Shop 122 Grapevine Hwy., Hurst, TX 76054, 800-930-4361",na,Labeling,Class III,4800 pellets,Voluntary: Firm initiated,Nationwide with the United States,Letter,7/26/2018,1/30/2020,Terminated,Hurst,TX,76054-2406,United States
340,83265,"Altaire Pharmaceuticals, Inc.",['na'],"CVS Health Fast Acting Lubricant Eye Drops Dry Eye Therapy, Twin Pack Item#: 994881, Product Size: 2 x 10 mL, Distributed by: CVS Pharmacy, Inc. One CVS Drive, Woonsocket, RI 02895",na,Lack of Assurance of Sterility,Class II,"39,744 units",Voluntary: Firm initiated,U.S.A. Nationwide,"Two or more of the following: Email, Fax, Letter, Press Release, Telephone, Visit",7/2/2019,,Ongoing,Aquebogue,NY,11931-0849,United States
341,65125,"THE COMPOUNDING SHOP, INC.",['na'],"Sodium EDTA 150 mg/mL Injectable, 250 mL vial, compounded by The Compounding Shop, St. Petersburg, FL",na,Lack of Assurance of Sterility,Class II,43 vials of 250mL each,Voluntary: Firm initiated,"Florida, California, Minnesota, and Maine","Two or more of the following: Email, Fax, Letter, Press Release, Telephone, Visit",5/2/2013,,Completed,St Petersburg,FL,33709-4034,United States
342,82278,Health Solutions Pharmacy Center Inc dba Professional Compounding Pharmacy,['na'],"PAPAVERINE-PHENTOLAMINE 15-0.5MGMG/ML INJECTABLE, 9ml, Professional Compounding Pharmacy, 996 NW Circle Blvd. #105 Corvallis, OR 97330 .",na,Lack of Processing Controls,Class II,1 prescription 9ml injectable,Voluntary: Firm initiated,Dispensed in Oregon,Telephone,2/21/2019,7/23/2020,Terminated,Corvallis,OR,97330-1485,United States
343,74187,Well Care Compounding Pharmacy,['na'],"ESTRADIOL CYPIONATE 10 MG/ML, packaged in 5mL vials, Rx only, Well Care Compounding Pharmacy Las Vegas, NV 89121",na,Lack of Assurance of Sterility,Class II,869 Units (Total All Products),Voluntary: Firm initiated,NV,Press Release,5/17/2016,1/13/2017,Terminated,Las Vegas,NV,89121-7345,United States
344,92707,"Central Admixture Pharmacy Services, Inc.",['na'],"Neonatal TPN Starter Bag, Amino Acids (trophamine) 3%/Dextrose 5% with CALCIUM, total volume = 250mL, IV Bag, Rx Only, Rx only, Central Admixture Pharmacy Services, Inc., 2200 South 43rd Avenue, Pheonix, AZ 85043, NDC: 72196-0413-1",na,Lack of Assurance of Sterility. Validation data for deContamination cycles is lacking.,Class II,96 bags,Voluntary: Firm initiated,Nationwide in the USA,Letter,7/14/2023,,Ongoing,Phoenix,AZ,85043-3909,United States
345,72520,Western Drug,['na'],"Cantharitus Multi-Mix Prep, Rx, Western Drug Inc. 106 E. Main Street, Springerville, Arizona 85938",na,Lack of Assurance of Sterility,Class II,1 container,Voluntary: Firm initiated,"Nationwide in US: Arizona, California, Georgia, New Mexico, South Carolina, South Dakota, Texas, and Utah",Telephone,10/19/2015,10/1/2016,Terminated,Springerville,AZ,85938-7203,United States
346,61818,Morton Salt Co.,['na'],"Morton, Sodium Chloride, USP, Granular, packaged in kraft paper bags, fiber drums, and semi-bulk bags.  Product is shipped in 80 lb bags, 350 lb drums & 2000 lb semi-bulk sacks.  Manufactured by Morton Salt, Inc., Chicago, Illinois 60606-1743.",na,Impurities/Degradation Products,Class III,"531,950 lbs",Voluntary: Firm initiated,Nationwide & PR & Ireland.,Letter,5/8/2012,3/1/2013,Terminated,Chicago,IL,60606-1743,United States
347,91443,Northern VA Compounders PLLC,['na'],"QuadMix Plus (PGE1/Papaverine HCl/Phentolamine Mesylate/Atropine) 20mcg/30mg/2mg/0.2mg/mL INJECTABLE, packaged in 2.5 mL Multiple-Dose vials, Rx Only, Compounded by: Akina Pharmacy, 23475 Rock Haven Way Suite 105, Sterling, VA  20166.",na,Lack of Assurance of Sterility,Class II,78 vials,Voluntary: Firm initiated,Nationwide in the USA,"Two or more of the following: Email, Fax, Letter, Press Release, Telephone, Visit",12/30/2022,6/21/2023,Terminated,Sterling,VA,20166-4444,United States
348,92133,Teva Pharmaceuticals USA Inc,['FENTANYL CITRATE'],"Fentanyl Buccal Tablets CII, 600mcg, packaged in cartons of 28 Buccal Tablets (4 tablets x 7 cards), Rx only, Distributed by: Mayne Pharma, Greenville, NC 27834, NDC 51862-637-28",BUCCAL,Labeling,Class III,1908,Voluntary: Firm initiated,US Nationwide,Letter,4/27/2023,2/29/2024,Terminated,Parsippany,NJ,07054-1120,United States
349,80601,King Bio Inc.,['na'],"Dr. King's SafeCare Rx Ear Relief Formula, 2 fl. oz. (59 mL), King Bio, Inc., 3 Westside Drive, Asheville, NC 28806 USA, UPC 357955015727, NDC 57955-0154-2",na,Microbial Contamination,Class I,185 bottles,Voluntary: Firm initiated,"U.S.A. Nationwide, Canada, and Australia.",Press Release,7/20/2018,1/19/2022,Terminated,Asheville,NC,28806-2846,United States
350,72179,US Compounding Inc,['na'],"HCG/B12 (5,000 units, 0.6 mg) 5 mL, Multi-Dose Vial, For IM or SC Injection, Rx only, Compounded by US Compounding Pharmacy, Conway, Arkansas, 72032, NDC 62295-3083-99",na,Lack of Assurance of Sterility; The firm is recalling all sterile preparations that are within expiry due to deficient practices which may have an impact on sterility assurance.,Class II,"7,852 vials",Voluntary: Firm initiated,Nationwide,Letter,9/12/2015,3/30/2017,Terminated,Conway,AR,72032,United States
351,86929,US Compounding Inc,['na'],"Neostigmine Methylsulfate PF Inj. 5 mg/5 mL, 5 mL Single Use Syringes, Hospital/Office Use Only. US Compounding 1270 Don's Lane Conway, AR 72032 (800) 718-3588  NDC 62295-3324-05",na,Labelling,Class III,1640 syringes,Voluntary: Firm initiated,Nationwide,Letter,11/25/2020,11/5/2021,Terminated,Conway,AR,72032-4753,United States
352,89646,Mckesson Medical-Surgical Inc. Corporate Office,['CLONIDINE HYDROCHLORIDE'],"Duraclon (clonidine HCl injection, USP), 1000 mcg/10 mL (100 mcg/mL), 10 mL single-dose vial, Rx only, MFG: Mylan Pharma, NDC 67457-218-10",EPIDURAL,CGMP Deviations,Class II,9 vials,Voluntary: Firm initiated,USA nationwide.,Letter,4/13/2022,11/30/2023,Terminated,Richmond,VA,23233,United States
353,93542,SUN PHARMACEUTICAL INDUSTRIES INC,['LIOTHYRONINE SODIUM'],"Liothyronine Sodium Tablets, USP 5 mcg, 100-count bottle, Rx Only, Distributed by: Sun Pharmaceutical Industries, Inc. Cranbury, NJ 08512 Manufactured by: Sun Pharmaceutical Industries Ltd. Survey No. 259/15, Dadra-396 191, (U.T. of D & NH), India. NDC 62756-589-88",ORAL,Failed Impurities/Degradation Specifications,Class II,"96,192 bottles",Voluntary: Firm initiated,Nationwide,Letter,12/4/2023,,Ongoing,Princeton,NJ,08540-6620,United States
354,84546,Assurance Infusion,['na'],LIPO B 25MG/50MG/50MG/1000MCG/ML  (10ML VIAL) in 20 mL syringe and 10 mL vial Assurance Infusion (713) 533-8800,na,Lack of Assurance of Sterility.,Class II,2 syringes/1 vial,Voluntary: Firm initiated,Nationwide within the United States,Letter,12/20/2019,10/27/2021,Terminated,Houston,TX,77054-2652,United States
355,92253,"Central Admixture Pharmacy Services, Inc.",['na'],"Neonatal TPN Starter Bag, Amino Acids (Trophamine) 3.5%/Dextrose 10%, packaged in 250 mL per bag, Rx only, Central Admixture Pharmacy Services, Inc., Lehigh Valley, 6580 Snowdrift Road, Allentown, PA  18106, NDC 71285-0406-1.",na,Lack of Assurance of Sterility,Class II,71 bags,Voluntary: Firm initiated,Nationwide in the USA.,E-Mail,4/28/2023,,Ongoing,Allentown,PA,18106-9331,United States
356,71371,The Compounding Pharmacy of America,['na'],"Hydromorphone 80 mg/ml + Bupivacaine 10 mg/ml + Clonidine 1,000 mcg/ml, Baclofen 500 mcg/ml Intrathecal Solution, Sterile-Preservative Free, The Compounding Pharmacy of America, Knoxville, TN",na,Lack of Assurance of Sterility; FDA inspection identified GMP violations potentially impacting product quality and sterility,Class II,22 ml,Voluntary: Firm initiated,Nationwide,Telephone,6/2/2015,2/10/2016,Terminated,Knoxville,TN,37919-4068,United States
357,71591,Liberty Drug & Surgical,['na'],"Vancomycin 25 mg/mL Opthalmic Solution, packaged in a) 10 mL bottle and b) 15 mL bottle, Rx only, Liberty Drug Compound Center, 195 Main St., PO Box 267, Chatham, NJ  07928.",na,Lack of Assurance of Sterility,Class II,3 bottles,Voluntary: Firm initiated,"Physicians, Medical Facilities, and Prescription Specific Patients in NJ and NY",Telephone,6/15/2015,4/23/2018,Terminated,Chatham,NJ,07928-2405,United States
358,65360,"Lowlite Investments, Inc. D/B/A Olympia Pharmacy",['na'],"Acetyl-D-Glucosamine w/Chondroitin 200 mg/ml, compounded by Olympia Pharmacy, Orlando, FL",na,Lack of Assurance of Sterility,Class II,1,Voluntary: Firm initiated,Nationwide and PR,"Two or more of the following: Email, Fax, Letter, Press Release, Telephone, Visit",5/29/2013,,Ongoing,Orlando,FL,32835-3500,United States
359,79149,American Pharmaceutical Ingredients LLC,['na'],"Calcipotriene BP (Monohydrate) for prescription compounding, packaged in a) 250mg (NDC 58597-8630-1); b) 500mg (NDC 58597-8630-2); c) 1g (NDC 58597-8630-3), Rx only, packed by American Pharmaceutical Ingredients, 6650 Highland Road, Waterford, MI 48327.",na,CGMP Deviations,Class II,10 g,Voluntary: Firm initiated,Nationwide within USA.,Letter,2/9/2018,12/2/2019,Terminated,Waterford,MI,48327-1665,United States
360,80668,Lupin Pharmaceuticals Inc.,['MOXIFLOXACIN HYDROCHLORIDE MONOHYDRATE'],"Moxifloxacin Ophthalmic Solution USP, 0.5%,  5 mL bottle, Rx only, Manufactured for: Lupin Pharmaceuticals Inc. Baltimore, Maryland 21202 United States, Manufactured by: Lupin Limited Pithampur (M.P.) 454 775, INDIA, NDC 68180-422-01",OPHTHALMIC,Failed Impurities/Degradation Specifications,Class III,"13,896 bottles",Voluntary: Firm initiated,Product was distributed throughout the United States,Letter,7/26/2018,12/6/2019,Terminated,Baltimore,MD,21202-6174,United States
361,70625,"Akorn, Inc.",['na'],"Fluticasone Propionate Nasal Spray, USP, 50 mcg per spray,  in amber glass bottle with net fill weight of 16 g that provides 120 actuations, Rx only, Manufactured by HI-TECH PHARMACAL CO., INC. Amityville, NY 11701 for Akorn Inc. 1925 W. Field Court, Suite 300 Lake Forest Illinois, 60045. NDC 50383-700-16.",na,Failed Stability Specifications,Class II,"44,448 bottles",Voluntary: Firm initiated,Nationwide and Puerto Rico,Letter,2/27/2015,11/30/2017,Terminated,Lake Forest,IL,60045,United States
362,88489,"Custopharm, Inc.",['na'],"FLUDARABINE PHOSPHATE FOR INJECTION, USP, 50 mg per vial, Single dose vial, Rx Only,    Mfd for: Leucadia Pharmaceuticals Carlsbad, CA 92011 U.S.A, NDC 24201-237-01",na,Lack of Assurance of Sterility,Class II,"19,384 vials",Voluntary: Firm initiated,Distributed Nationwide in the USA,Letter,7/30/2021,8/8/2022,Terminated,Carlsbad,CA,92011-1567,United States
363,65707,"Aidapak Services, LLC",['na'],"guaiFENesin ER, Tablet, 600 mg, Rx only, Distributed by: AidaPak Service, LLC, NDC 63824000815",na,Labeling,Class II,600 Tablets,Voluntary: Firm initiated,"Repacked drugs were distributed in Arizona, California, Oregon, and Washington.",Telephone,7/2/2013,2/7/2014,Terminated,Vancouver,WA,98684-3501,United States
364,78678,SSM Health Care St. Louis DBA SSM St. Clare Health Center,['na'],"Norepinephrine 8 mg in dextrose 5% 250 mL, 250mL IV Bag, Concentration: 0.032 mg/mL, This is a compounded injectable drug; Rx only; Hospital/office use only. SSM St. Clare Outsourcing Facility, , Fenton, MO --- NDC: 88890-0334-01",na,Lack of Assurance of Sterility,Class II,,Voluntary: Firm initiated,SSM Health entities in the state of MO only,E-Mail,8/10/2017,3/22/2018,Terminated,Fenton,MO,63026-2394,United States
365,75300,Teva Pharmaceuticals USA,['na'],"PARICALCITOL Capsules, 2 mcg, 30-count bottles, Rx only, Manufactured By: Pharmaceutics International, Inc., Hunt Vallet, MD  21031; Manufactured For: Teva Pharmaceuticals USA, Inc., North Wales, PA  19454, NDC 0093-7657-56.",na,Failed Impurities/Degradation Specifications,Class III,"5,556 bottles",Voluntary: Firm initiated,Nationwide and Puerto Rico,Letter,9/22/2016,5/5/2017,Terminated,North Wales,PA,19454-1505,United States
366,71371,The Compounding Pharmacy of America,['na'],"Fentanyl 2,000 mcg/ml + Bupivacaine 20 mg/ml Intrathecal Solution, Sterile - Preservative Free, The Compounding Pharmacy of America, Knoxville, TN",na,Lack of Assurance of Sterility; FDA inspection identified GMP violations potentially impacting product quality and sterility,Class II,43 ml total volume,Voluntary: Firm initiated,Nationwide,Telephone,6/2/2015,2/10/2016,Terminated,Knoxville,TN,37919-4068,United States
367,89766,Macleods Pharma Usa Inc,['RISEDRONATE SODIUM'],"Risedronate Sodium Tablets, USP, 5 mg, Rx Only, 30-count bottle, Manufactured for: Macleods Pharma USA, Plainsboro, NJ 08536, Manufactured by: Macleods Pharmaceuticals Ltd., BAddi, HImchal Pradesh, INDIA, NDC 33342-107-07.",ORAL,FAILED CONTENT UNIFORMITY SPECIFICATIONS,Class III,4872 bottles,Voluntary: Firm initiated,USA Nationwide,Letter,3/10/2022,6/29/2023,Terminated,Plainsboro,NJ,08536-0009,United States
368,69152,"Martin Avenue Pharmacy, Inc.",['na'],"Hyaluronidase injection solution (PF) 150 U/mL injectable packaged in an amber glass injectable vial, Martin Avenue Pharmacy, 1247 Rickert Dr, Naperville, IL.",na,Lack of Assurance of Sterility,Class II,40 mL,Voluntary: Firm initiated,Nationwide,"Two or more of the following: Email, Fax, Letter, Press Release, Telephone, Visit",8/27/2014,5/31/2018,Terminated,Naperville,IL,60540-1008,United States
369,83074,RXQ Compounding LLC,['na'],"VITAMIN B COMPLEX 100 (MDV), 30 ML per Vial, RXQ Compounding, 340 West State Street, Unit 9, Athens, OH 45701. NDC 70731-0976-30",na,Lack of Assurance of Sterility,Class II,,Voluntary: Firm initiated,Nationwide USA,Press Release,6/19/2019,9/16/2022,Terminated,Athens,OH,45701-1564,United States
370,80601,King Bio Inc.,['na'],"Dr. King's Natural Medicine Homeopathic Mood Changes, 2 fl. oz. (59 mL), King Bio, Inc., 3 Westside Dr. Asheville, NC 28806, UPC 357955503729, NDC 57955-5037-2",na,Microbial Contamination,Class I,31 bottles,Voluntary: Firm initiated,"U.S.A. Nationwide, Canada, and Australia.",Press Release,7/20/2018,1/19/2022,Terminated,Asheville,NC,28806-2846,United States
371,90948,"Akorn, Inc.",['na'],"Ofloxacin Ophthalmic Solution, USP 0.3%, 5 mL per bottle, Rx Only, Manufactured by: Akorn, Inc., Lake Forest, IL 60045; Distributed by: MWI, Boise, ID 83705. NDC: 13985-602-05",na,CGMP Deviations,Class II,"65,006 bottles",Voluntary: Firm initiated,Nationwide in the USA,Letter,10/13/2022,,Ongoing,Gurnee,IL,60031-5278,United States
372,71371,The Compounding Pharmacy of America,['na'],"Morphine 25 mg/ml + Bupivacaine 30 mg/ml + Clonidine 200 mcg/ml Solution, Sterile, Preservative Free, The Compounding Pharmacy of America, Knoxville, TN",na,Lack of Assurance of Sterility; FDA inspection identified GMP violations potentially impacting product quality and sterility,Class II,43 ml,Voluntary: Firm initiated,Nationwide,Telephone,6/2/2015,2/10/2016,Terminated,Knoxville,TN,37919-4068,United States
373,86833,"Taro Pharmaceuticals U.S.A., Inc.",['CLOTRIMAZOLE'],"Kroger Athlete's Foot Cream, Clotrimazole Cream USP, 1%, Antifungal, NET WT 0.5 OZ (15g), Distributed by The Kroger Co. Cincinnati, Ohio 45202 Made in Canada. NDC 30142-305-01",TOPICAL,Failed Impurities/Degradation Specifications,Class II,"133,452 0.5 oz tubes",Voluntary: Firm initiated,Distributed Nationwide in the USA and Canada,Letter,11/17/2020,2/21/2024,Terminated,Hawthorne,NY,10532-2174,United States
374,92341,Astral SteriTech Private Ltd.,"['AMPICILLIN SODIUM', 'SULBACTAM SODIUM']","Ampicillin and Sulbactam for Injection, USP 1.5 grams per vial, Rx only, Mfd for Meitheal Pharmaceuticals Chicago, IL 60631, NDC 71288-005-20",INTRAMUSCULAR,Lack of Assurance of Sterility,Class II,"236,610 vials",Voluntary: Firm initiated,Nationwide within the United States,Letter,5/15/2023,,Ongoing,Vadodara,,,India
375,67935,Hospira Inc.,['na'],"Potassium Chloride for Inj. Concentrate, USP, 40 mEq (2  mEq/mL), 20 mL Single-dose Fliptop Vial, For IV use, Rx only, Hospira, Inc., Lake Forest, IL 60045 USA",na,Presence of Particulate; red and black particulate within the solution and embedded within the plastic vial identified as iron oxide,Class II,"255,900 vials",Voluntary: Firm initiated,Nationwide,Letter,3/27/2014,6/30/2015,Terminated,Lake Forest,IL,60045-2579,United States
376,65154,Lloyd Inc. of Iowa,['na'],"Lloyd Thyro-Tab 0.050 mg., packaged in 150,000-tablet bulk drums (2/75,000-tablet bags/drum) for repackaging, RX.  The firm name on the label is Lloyd Pharmaceutical, Shenandoah, IA.",na,"CGMP Deviations; After quality review of stability failures in previous lots, there is insufficient data to determine that other lots are not affected.",Class II,"7,681,277 tablets",Voluntary: Firm initiated,"The firm distributed the bulk product to Forest Laboratories, Inc, St. Louis, MO who repackaged the product into 100-tablet bottles and distribution was made to 75 customers Nationwide and Puerto Rico.",Letter,4/1/2013,5/8/2014,Terminated,Shenandoah,IA,51601-1744,United States
377,64640,"Med Prep Consulting, Inc.",['na'],"Magnesium Sulfate 2 grams in Dextrose 5% for Injection, in 50 mL Plastic Infusion Bags, Med Prep Consulting Inc., Tinton Falls, NJ 07712",na,Lack of Assurance of Sterility; mold Contamination,Class I,403883 bags,Voluntary: Firm initiated,"Press States Nationwide. Distribution List indicates the following:    DE, FL, IL,  IN, ME, MI, NJ, PA, TX, and VA",Telephone,3/14/2013,5/11/2018,Terminated,Tinton Falls,NJ,07712-3192,United States
378,89949,Pink Toyz,['na'],"Pink Pussycat SENSUAL ENHANCEMENT capsule, 3000mg, 1-count blister card, Manufactured for: Pink Pussycat Products - Chatsworth, CA  91311, UPC 8 91875 00462 6.",na,Marketed Without An Approved NDA/ANDA,Class I,120 blister cards,Voluntary: Firm initiated,Nationwide in the USA via walmart.com online marketplace,"Two or more of the following: Email, Fax, Letter, Press Release, Telephone, Visit",3/29/2022,,Ongoing,Chatsworth,CA,91311-5917,United States
379,66015,Novartis Pharmaceuticals Corp.,['na'],"Tekturna (aliskiren) Tablets 150 mg, 7 tablets per bottle, Physician Sample-Not For Sale, Rx only.  Manufactured by: Novartis Pharma Productions GmbH Wehr, Germany.  Distributed by: Novartis Pharmaceuticals Corp. East Hanover, New Jersey 07936, NDC # 0078-9485-07",na,Chemical Contamination,Class II,"12,6245 bottles",Voluntary: Firm initiated,Nationwide and Puerto Rico,Letter,8/8/2013,12/21/2015,Terminated,Suffern,NY,10901-4106,United States
380,80307,"Avella of Deer Valley, Inc. Store 38",['na'],"0.2% ROPivacaine, (Ropivacaine HCL PF, USP 500mg, 0.9% Sodium Chloride, USP QS 250 mL). Volume 250 mL. Single dose Cassette. For: Parkland Memorial Hospital. By: Advanced Pharma, 9225 Kirby Dr. Houston, TX 77054. Parkland Memorial Hospital NDC 15082-002-87",na,Lack of Assurance of Sterility,Class II,20 bags,Voluntary: Firm initiated,Nationwide in the USA,Letter,6/12/2018,1/24/2020,Terminated,Phoenix,AZ,85085-1887,United States
381,78553,"KRS Global Biotechnology, Inc",['na'],"Savinase 100 mcg/mL Topical Solution, 1 mL in a 3 mL Droptainer, Rx Only, KRS Global Biotechnology, 791 Park of Commerce Blvd, Boca Raton, FL 33487.",na,Labeling,Class II,30 droptainers,Voluntary: Firm initiated,"Nationwide in the USA, Bermuda, and New Zealand",Letter,11/16/2017,5/11/2020,Terminated,Boca Raton,FL,33487-3633,United States
382,65702,Bayer HealthCare Pharmaceuticals Inc.,['na'],"Medroxyprogesterone acetate, micronized (EP, USP) active pharmaceutical ingredient, Rx only, packaged in 6.0 kg drums (labeled as 6,000 kg), Bayer Schering Pharma AG, D-13342 Berlin",na,Failed Stability Specifications,Class III,194.62 kg,Voluntary: Firm initiated,"NY, CA",Letter,6/13/2013,2/10/2014,Terminated,Morristown,NJ,07960-4526,United States
383,73925,"Pharmedium Services, LLC",['na'],"ketamine HCl, 10 mg per mL, 50 mg per 5 mL, in 0.9% Sodium Chloride, 5 mL Total Volume in a syringe, For IV Use, Rx only, PharMEDium, Product code 2R3234.",na,Stability Data Does Not Support Expiry,Class II,25 syringes,Voluntary: Firm initiated,Nationwide,E-Mail,7/17/2015,6/23/2017,Terminated,Lake Forest,IL,60045-2506,United States
384,88862,"Vita Pharmacy, LLC dba Talon Compounding Pharmacy",['na'],"TESTOSTERONE CYPIONATE 200MG/ML INJ #2 IN SESAME OIL INJECTABLE, Rx only, Talon Compounding Pharmacy, 2950 Thousand Oaks Drive Ste 25, San Antonio, Texas 78247",na,Lack of Assurance of Sterility,Class II,43 vials,Voluntary: Firm initiated,"United States including Washington, D.C. and Puerto Rico",Telephone,10/12/2021,10/4/2023,Terminated,San Antonio,TX,78247-3347,United States
385,73925,"Pharmedium Services, LLC",['na'],"HYDROmorphone HCl, 1 mg per mL, in 0.9% Sodium Chloride, 1 mL Total Volume in a syringe, For IV Use, Rx only, PharMEDium, Product code 2T6165",na,Stability Data Does Not Support Expiry,Class II,450 syringes,Voluntary: Firm initiated,Nationwide,E-Mail,7/17/2015,6/23/2017,Terminated,Lake Forest,IL,60045-2506,United States
386,72520,Western Drug,['na'],"Podophyllum 40% Topical, Rx, Western Drug Inc. 106 E. Main Street, Springerville, Arizona 85938",na,Lack of Assurance of Sterility,Class II,1 container,Voluntary: Firm initiated,"Nationwide in US: Arizona, California, Georgia, New Mexico, South Carolina, South Dakota, Texas, and Utah",Telephone,10/19/2015,10/1/2016,Terminated,Springerville,AZ,85938-7203,United States
387,87941,Global Sanitizers LLC,['na'],"MEDICALLY MINDED Hand Sanitizer Gel, ANTIMICROBIAL FORMULA, (Ethyl Alcohol 70% v/v), 8 FL OZ (236 mL) bottle, Manufactured by Asiaticon, S.A. de C.V. Conkal 62, Jardines del Ajusco, Tlalpan, Ciudad de Mexico, C.P. 14200, Distributed by SBL Brands, LLC. Las Vegas, NV 89119. Made in Mexico UPC: 6 76753 00420 8,",na,Chemical Contamination,Class I,"50,000 bottles",Voluntary: Firm initiated,Product Distributed Nationwide in the USA,Letter,5/12/2021,,Ongoing,Las Vegas,NV,89118-3111,United States
388,81910,Prinston Pharmaceutical Inc,"['HYDROCHLOROTHIAZIDE', 'IRBESARTAN']","Irbesartan and Hydrochlorothiazide Tablets, USP 300/12.5 mg Rx Only Manufactured by: Zhejiang Huahai Pharmaceutical Co., Ltd. Xunqiao, Linhai, Zheijang 317024, China   Distributed by: Solco Healthcare US, LLC Cranbury, NJ 08512  30 count - NDC 43547-331-03",ORAL,CGMP Deviations,Class II,32692 bottles,Voluntary: Firm initiated,Nationwide,Letter,1/18/2019,,Completed,Somerset,NJ,08873-4107,United States
389,72594,Walgreens Infusion Services,['na'],"0.9% NaCl 1000 mL with Ca 4.65 meq bag, Rx Only, Compounded by Option Care 148, San Antonio, TX 78232-5045",na,Lack of Assurance of Sterility,Class II,7 bags,Voluntary: Firm initiated,Texas,Letter,11/10/2015,10/18/2017,Terminated,San Antonio,TX,78232-5045,United States
390,66043,"Fabscout Entertainment, Inc",['na'],"72HP MAXIMUM POTENCY MALE SEXUAL ENHANCEMENT, Dietary Supplement, supplied in 1 capsule per blister pack, Distributed by: 72HP, Inc. Weston, FL",na,Marketed Without An Approved NDA/ANDA,Class I,578 blister packs of 1 capsule each,Voluntary: Firm initiated,"CA, FL and UT","Two or more of the following: Email, Fax, Letter, Press Release, Telephone, Visit",8/14/2013,2/10/2021,Terminated,Ft Lauderdale,FL,33311-5147,United States
391,77065,Mylan Pharmaceuticals Inc.,"['ETHINYL ESTRADIOL', 'NORETHINDRONE ACETATE']","Norethindrone Acetate and Ethinyl Estradiol Tablets, USP, 1 mg/0.02 mg, 1 blister pack containing 21 tablets (NDC 0378-7280-85), packaged in 3 pouches, each contains one blister pack of 21 tablets (NDC 0378-7280-53), Rx only, Manufactured for: Mylan Pharmaceuticals Inc., Morgantown, WV  26505 U.S.A., Made in India.",ORAL,Chemical Contamination,Class III,"8,605 cartons",Voluntary: Firm initiated,Nationwide in USA,E-Mail,1/30/2017,6/1/2017,Terminated,Morgantown,WV,26505-2730,United States
392,70452,Attix Pharmaceuticals,['na'],"Lodenafil Carbonate active pharmaceutical ingredient packaged in varying grams or kg in bags or drums, Attix Pharmaceuticals, 184 Front Street East, Unit 801, Toronto, Ontario M5A 4N3, Canada",na,Penicillin Cross Contamination,Class II,100 grams,Voluntary: Firm initiated,Nationwide to compounding pharmacies and research organizations.,"Two or more of the following: Email, Fax, Letter, Press Release, Telephone, Visit",11/14/2014,10/7/2015,Terminated,Toronto,,,Canada
393,78791,SHISEIDO AMERICA INC.,['na'],"Shiseido Future Solution LX Universal Defense SPF 50+ (octinoxate 4.9%, octocrylebe 3.0%, oxybenzone 1.0% and zinc oxide 15.4%), packaged in a) 2mL, b) 15 mL and c) 50 mL tubes, Shiseido Americas Corporation Dist. New York, NY 10022. NDC 58411-256-60",na,CGMP Deviations,Class II,,Voluntary: Firm initiated,Product was distributed nationwide.,Letter,12/14/2017,6/24/2021,Terminated,East Windsor,NJ,08520-1411,United States
394,70118,Walgreens Infusion Services,['na'],Acyclovir various strengths in normal saline,na,Lack of Assurance of Sterility.,Class II,,Voluntary: Firm initiated,"Texas, Florida, Virginia, Georgia, Louisiana, Mississippi",Letter,12/26/2014,7/24/2015,Terminated,Houston,TX,77054-2504,United States
